{
  "schema_version": "1.0",
  "project_id": "yt-smoke0p3aa",
  "language": "en",
  "source_language": "fa",
  "script_class": "latin",
  "glossary_id": "smoke-chan",
  "engine": {
    "provider": "agent",
    "model": null,
    "version": null
  },
  "has_word_timing": false,
  "cues": [
    {
      "id": 0,
      "start_ms": 0,
      "end_ms": 2500,
      "source_text": "سلام، من درباره انقلاب صحبت می‌کنم.",
      "target_text": "Hello, I speak about the Revolution.",
      "flags": [
        "editorial-political"
      ]
    },
    {
      "id": 1,
      "start_ms": 2500,
      "end_ms": 6000,
      "source_text": "این یک جمله دوم برای آزمایش است.",
      "target_text": "This is a second test sentence."
    }
  ],
  "created_at": "2026-08-03T05:35:21Z",
  "created_by": "agent"
}
